{
  "$schema":"https://json-schema.org/draft/2020-12/schema",
  "$id":"statarea-semantic-assessment/1.0",
  "type":"object","additionalProperties":false,
  "required":["contractVersion","assessment","registryReference","datasetReference","qualityTotals","qualityByField","qualityByDate","matchedReadiness","findings","warnings","resultsUsed","networkRequests","assessmentHash"],
  "properties": {
    "contractVersion":{"const":"statarea-semantic-assessment/1.0"},
    "assessment":{"type":"object","additionalProperties":false,"required":["id","version","status","createdAt","rowCount"],"properties":{"id":{"type":"string","minLength":1},"version":{"const":"statarea-semantic-assessment/1.0.0"},"status":{"const":"COMPLETED"},"createdAt":{"type":"string","format":"date-time"},"rowCount":{"const":1110}}},
    "registryReference":{"type":"object","additionalProperties":false,"required":["id","code","version","registryHash","legendSha256"],"properties":{"id":{"type":"string"},"code":{"const":"STATAREA-LEGACY-SEMANTIC-REGISTRY"},"version":{"const":"1.0.0"},"registryHash":{"$ref":"#/$defs/hash"},"legendSha256":{"const":"7b12c7c3795000ca30a29afe7b65d863f1a9a5f426b81cd012a3fe37feebb3c0"}}},
    "datasetReference":{"type":"object","additionalProperties":false,"required":["id","code","version","status","sourcePresentation","manifestHash"],"properties":{"id":{"type":"string"},"code":{"const":"OU25-JULY-2026-V1"},"version":{"const":"1.0.0"},"status":{"const":"FROZEN"},"sourcePresentation":{"const":"LEGACY_OFFICIAL"},"manifestHash":{"const":"b651152816688759d54486ebc4cdac11704dd9e287818dec6b7f935c185ed105"}}},
    "qualityTotals":{"$ref":"#/$defs/qualityTotals"},
    "qualityByField":{"type":"array","minItems":9,"items":{"$ref":"#/$defs/fieldQuality"}},
    "qualityByDate":{"type":"array","minItems":21,"maxItems":21,"items":{"$ref":"#/$defs/dateQuality"}},
    "matchedReadiness":{"$ref":"#/$defs/matchedReadiness"},
    "findings":{"type":"array","items":{"type":"object","additionalProperties":false,"required":["field","findingType","severity","count","expectedRule"],"properties":{"field":{"type":"string"},"findingType":{"type":"string"},"severity":{"enum":["INFO","WARNING","ERROR"]},"count":{"type":"integer","minimum":0},"expectedRule":{"type":"string"}}}},
    "warnings":{"type":"array","items":{"type":"string","maxLength":240}},"resultsUsed":{"const":0},"networkRequests":{"const":0},"assessmentHash":{"$ref":"#/$defs/hash"}
  },
  "$defs": {
    "hash":{"type":"string","pattern":"^[a-f0-9]{64}$"},
    "residual":{"type":"object","additionalProperties":false,"required":["total","exact100","withinTolerance","outsideTolerance","averageAbsoluteResidual","maximumAbsoluteResidual","tolerancePercentagePoints"],"properties":{"total":{"type":"integer","minimum":0},"exact100":{"type":"integer","minimum":0},"withinTolerance":{"type":"integer","minimum":0},"outsideTolerance":{"type":"integer","minimum":0},"averageAbsoluteResidual":{"type":"string"},"maximumAbsoluteResidual":{"type":"string"},"tolerancePercentagePoints":{"const":"1"}}},
    "qualityTotals":{"type":"object","additionalProperties":false,"required":["rows","ready","readyWithWarnings","insufficient","rejected","invalidValues","missingValues","oneXTwo","halfTime","monotonicity","complementsValid","doubleChanceIdentitiesWithinTolerance","derivedQuality"],"properties":{"rows":{"const":1110},"ready":{"type":"integer","minimum":0},"readyWithWarnings":{"type":"integer","minimum":0},"insufficient":{"type":"integer","minimum":0},"rejected":{"type":"integer","minimum":0},"invalidValues":{"type":"integer","minimum":0},"missingValues":{"type":"integer","minimum":0},"oneXTwo":{"$ref":"#/$defs/residual"},"halfTime":{"$ref":"#/$defs/residual"},"monotonicity":{"type":"object","additionalProperties":false,"required":["compliant","violations","maximumViolation","affectedDates","affectedCountries","affectedCompetitions"],"properties":{"compliant":{"type":"integer"},"violations":{"type":"integer"},"maximumViolation":{"type":"string"},"affectedDates":{"type":"array","items":{"type":"string","format":"date"}},"affectedCountries":{"type":"array","items":{"type":"string"}},"affectedCompetitions":{"type":"array","items":{"type":"string"}}}},"complementsValid":{"type":"integer"},"doubleChanceIdentitiesWithinTolerance":{"type":"integer"},"derivedQuality":{"type":"array","minItems":6,"maxItems":6,"items":{"$ref":"#/$defs/derivedQuality"}}}},
    "derivedQuality":{"type":"object","additionalProperties":false,"required":["field","total","derivable","notDerivable","outOfRange","maximumDecimalPlaces","sourcePrecisionPreserved","warnings"],"properties":{"field":{"type":"string"},"total":{"const":1110},"derivable":{"type":"integer","minimum":0},"notDerivable":{"type":"integer","minimum":0},"outOfRange":{"type":"integer","minimum":0},"maximumDecimalPlaces":{"type":"integer","minimum":0},"sourcePrecisionPreserved":{"const":true},"warnings":{"type":"array","items":{"type":"string"}}}},
    "fieldQuality":{"type":"object","additionalProperties":false,"required":["field","total","present","missing","parseable","invalid","outOfRange","minimum","maximum","distinctValues","formatsObserved","affectedDates","affectedCountries","affectedCompetitions"],"properties":{"field":{"type":"string"},"total":{"const":1110},"present":{"type":"integer"},"missing":{"type":"integer"},"parseable":{"type":"integer"},"invalid":{"type":"integer"},"outOfRange":{"type":"integer"},"minimum":{"type":["string","null"]},"maximum":{"type":["string","null"]},"distinctValues":{"type":"integer"},"formatsObserved":{"type":"array","items":{"type":"string"}},"affectedDates":{"type":"array","items":{"type":"string","format":"date"}},"affectedCountries":{"type":"array","items":{"type":"string"}},"affectedCompetitions":{"type":"array","items":{"type":"string"}}}},
    "dateQuality":{"type":"object","additionalProperties":false,"required":["sportsDate","partition","rows","ready","readyWithWarnings","insufficient","rejected","invalidValues","warnings"],"properties":{"sportsDate":{"type":"string","format":"date"},"partition":{"enum":["DISCOVERY","VALIDATION"]},"rows":{"type":"integer"},"ready":{"type":"integer"},"readyWithWarnings":{"type":"integer"},"insufficient":{"type":"integer"},"rejected":{"type":"integer"},"invalidValues":{"type":"integer"},"warnings":{"type":"array","items":{"type":"string"}}}},
    "matchedReadiness":{"type":"object","additionalProperties":false,"required":["total","discovery","validation","ou25SemanticReady","doubleChanceSemanticReady","bothReady","htSemanticReady","handicap01SemanticReady","withWarnings","insufficient"],"properties":{"total":{"const":98},"discovery":{"const":64},"validation":{"const":34},"ou25SemanticReady":{"type":"integer"},"doubleChanceSemanticReady":{"type":"integer"},"bothReady":{"type":"integer"},"htSemanticReady":{"type":"integer"},"handicap01SemanticReady":{"type":"integer"},"withWarnings":{"type":"integer"},"insufficient":{"type":"integer"}}}
  }
}
