{
  "contractVersion":"statarea-semantic-assessment/1.0",
  "assessment":{"id":"assessment-fixture","version":"statarea-semantic-assessment/1.0.0","status":"COMPLETED","createdAt":"2026-07-22T19:45:00.000Z","rowCount":1110},
  "registryReference":{"id":"registry-fixture","code":"STATAREA-LEGACY-SEMANTIC-REGISTRY","version":"1.0.0","registryHash":"735762986050e6fc0d763c180b23cf7a28439ca92fd6ea934d4725531f9650d3","legendSha256":"7b12c7c3795000ca30a29afe7b65d863f1a9a5f426b81cd012a3fe37feebb3c0"},
  "datasetReference":{"id":"ou25-july-2026-v1","code":"OU25-JULY-2026-V1","version":"1.0.0","status":"FROZEN","sourcePresentation":"LEGACY_OFFICIAL","manifestHash":"b651152816688759d54486ebc4cdac11704dd9e287818dec6b7f935c185ed105"},
  "qualityTotals":{"rows":1110,"ready":0,"readyWithWarnings":1110,"insufficient":0,"rejected":0,"invalidValues":0,"missingValues":0,"oneXTwo":{"total":1110,"exact100":1110,"withinTolerance":1110,"outsideTolerance":0,"averageAbsoluteResidual":"0","maximumAbsoluteResidual":"0","tolerancePercentagePoints":"1"},"halfTime":{"total":1110,"exact100":1110,"withinTolerance":1110,"outsideTolerance":0,"averageAbsoluteResidual":"0","maximumAbsoluteResidual":"0","tolerancePercentagePoints":"1"},"monotonicity":{"compliant":1110,"violations":0,"maximumViolation":"0","affectedDates":[],"affectedCountries":[],"affectedCompetitions":[]},"complementsValid":1110,"doubleChanceIdentitiesWithinTolerance":1110,"derivedQuality":[{"field":"sourceUnder15Percent","total":1110,"derivable":1110,"notDerivable":0,"outOfRange":0,"maximumDecimalPlaces":0,"sourcePrecisionPreserved":true,"warnings":["Valor derivado; no es una probabilidad real ni calibrada."]},{"field":"sourceUnder25Percent","total":1110,"derivable":1110,"notDerivable":0,"outOfRange":0,"maximumDecimalPlaces":0,"sourcePrecisionPreserved":true,"warnings":["Valor derivado; no es una probabilidad real ni calibrada."]},{"field":"sourceUnder35Percent","total":1110,"derivable":1110,"notDerivable":0,"outOfRange":0,"maximumDecimalPlaces":0,"sourcePrecisionPreserved":true,"warnings":["Valor derivado; no es una probabilidad real ni calibrada."]},{"field":"sourceDoubleChance1XPercent","total":1110,"derivable":1110,"notDerivable":0,"outOfRange":0,"maximumDecimalPlaces":0,"sourcePrecisionPreserved":true,"warnings":["Valor derivado; no es una probabilidad real ni calibrada."]},{"field":"sourceDoubleChanceX2Percent","total":1110,"derivable":1110,"notDerivable":0,"outOfRange":0,"maximumDecimalPlaces":0,"sourcePrecisionPreserved":true,"warnings":["Valor derivado; no es una probabilidad real ni calibrada."]},{"field":"sourceDoubleChance12Percent","total":1110,"derivable":1110,"notDerivable":0,"outOfRange":0,"maximumDecimalPlaces":0,"sourcePrecisionPreserved":true,"warnings":["Valor derivado; no es una probabilidad real ni calibrada."]}]},
  "qualityByField":[
    {"field":"sourceHomeWinPercent","total":1110,"present":1110,"missing":0,"parseable":1110,"invalid":0,"outOfRange":0,"minimum":"15","maximum":"84","distinctValues":67,"formatsObserved":["INTEGER_PERCENT"],"affectedDates":[],"affectedCountries":[],"affectedCompetitions":[]},
    {"field":"sourceDrawPercent","total":1110,"present":1110,"missing":0,"parseable":1110,"invalid":0,"outOfRange":0,"minimum":"11","maximum":"51","distinctValues":34,"formatsObserved":["INTEGER_PERCENT"],"affectedDates":[],"affectedCountries":[],"affectedCompetitions":[]},
    {"field":"sourceAwayWinPercent","total":1110,"present":1110,"missing":0,"parseable":1110,"invalid":0,"outOfRange":0,"minimum":"5","maximum":"74","distinctValues":68,"formatsObserved":["INTEGER_PERCENT"],"affectedDates":[],"affectedCountries":[],"affectedCompetitions":[]},
    {"field":"sourceHtHomeWinPercent","total":1110,"present":1110,"missing":0,"parseable":1110,"invalid":0,"outOfRange":0,"minimum":"15","maximum":"71","distinctValues":50,"formatsObserved":["INTEGER_PERCENT"],"affectedDates":[],"affectedCountries":[],"affectedCompetitions":[]},
    {"field":"sourceHtDrawPercent","total":1110,"present":1110,"missing":0,"parseable":1110,"invalid":0,"outOfRange":0,"minimum":"18","maximum":"67","distinctValues":43,"formatsObserved":["INTEGER_PERCENT"],"affectedDates":[],"affectedCountries":[],"affectedCompetitions":[]},
    {"field":"sourceHtAwayWinPercent","total":1110,"present":1110,"missing":0,"parseable":1110,"invalid":0,"outOfRange":0,"minimum":"5","maximum":"63","distinctValues":54,"formatsObserved":["INTEGER_PERCENT"],"affectedDates":[],"affectedCountries":[],"affectedCompetitions":[]},
    {"field":"sourceOver15Percent","total":1110,"present":1110,"missing":0,"parseable":1110,"invalid":0,"outOfRange":0,"minimum":"49","maximum":"95","distinctValues":42,"formatsObserved":["INTEGER_PERCENT"],"affectedDates":[],"affectedCountries":[],"affectedCompetitions":[]},
    {"field":"sourceOver25Percent","total":1110,"present":1110,"missing":0,"parseable":1110,"invalid":0,"outOfRange":0,"minimum":"28","maximum":"85","distinctValues":58,"formatsObserved":["INTEGER_PERCENT"],"affectedDates":[],"affectedCountries":[],"affectedCompetitions":[]},
    {"field":"sourceOver35Percent","total":1110,"present":1110,"missing":0,"parseable":1110,"invalid":0,"outOfRange":0,"minimum":"12","maximum":"75","distinctValues":60,"formatsObserved":["INTEGER_PERCENT"],"affectedDates":[],"affectedCountries":[],"affectedCompetitions":[]}
  ],
  "qualityByDate":[
    {"sportsDate":"2026-07-01","partition":"DISCOVERY","rows":30,"ready":0,"readyWithWarnings":30,"insufficient":0,"rejected":0,"invalidValues":0,"warnings":["TIPS_UNVERIFIED"]},
    {"sportsDate":"2026-07-02","partition":"DISCOVERY","rows":22,"ready":0,"readyWithWarnings":22,"insufficient":0,"rejected":0,"invalidValues":0,"warnings":["TIPS_UNVERIFIED"]},
    {"sportsDate":"2026-07-03","partition":"DISCOVERY","rows":41,"ready":0,"readyWithWarnings":41,"insufficient":0,"rejected":0,"invalidValues":0,"warnings":["TIPS_UNVERIFIED"]},
    {"sportsDate":"2026-07-04","partition":"DISCOVERY","rows":108,"ready":0,"readyWithWarnings":108,"insufficient":0,"rejected":0,"invalidValues":0,"warnings":["TIPS_UNVERIFIED"]},
    {"sportsDate":"2026-07-05","partition":"DISCOVERY","rows":56,"ready":0,"readyWithWarnings":56,"insufficient":0,"rejected":0,"invalidValues":0,"warnings":["TIPS_UNVERIFIED"]},
    {"sportsDate":"2026-07-06","partition":"DISCOVERY","rows":10,"ready":0,"readyWithWarnings":10,"insufficient":0,"rejected":0,"invalidValues":0,"warnings":["TIPS_UNVERIFIED"]},
    {"sportsDate":"2026-07-07","partition":"DISCOVERY","rows":21,"ready":0,"readyWithWarnings":21,"insufficient":0,"rejected":0,"invalidValues":0,"warnings":["TIPS_UNVERIFIED"]},
    {"sportsDate":"2026-07-08","partition":"DISCOVERY","rows":35,"ready":0,"readyWithWarnings":35,"insufficient":0,"rejected":0,"invalidValues":0,"warnings":["TIPS_UNVERIFIED"]},
    {"sportsDate":"2026-07-09","partition":"DISCOVERY","rows":26,"ready":0,"readyWithWarnings":26,"insufficient":0,"rejected":0,"invalidValues":0,"warnings":["TIPS_UNVERIFIED"]},
    {"sportsDate":"2026-07-10","partition":"DISCOVERY","rows":57,"ready":0,"readyWithWarnings":57,"insufficient":0,"rejected":0,"invalidValues":0,"warnings":["TIPS_UNVERIFIED"]},
    {"sportsDate":"2026-07-11","partition":"DISCOVERY","rows":147,"ready":0,"readyWithWarnings":147,"insufficient":0,"rejected":0,"invalidValues":0,"warnings":["TIPS_UNVERIFIED"]},
    {"sportsDate":"2026-07-12","partition":"DISCOVERY","rows":68,"ready":0,"readyWithWarnings":68,"insufficient":0,"rejected":0,"invalidValues":0,"warnings":["TIPS_UNVERIFIED"]},
    {"sportsDate":"2026-07-13","partition":"DISCOVERY","rows":16,"ready":0,"readyWithWarnings":16,"insufficient":0,"rejected":0,"invalidValues":0,"warnings":["TIPS_UNVERIFIED"]},
    {"sportsDate":"2026-07-14","partition":"DISCOVERY","rows":53,"ready":0,"readyWithWarnings":53,"insufficient":0,"rejected":0,"invalidValues":0,"warnings":["TIPS_UNVERIFIED"]},
    {"sportsDate":"2026-07-15","partition":"VALIDATION","rows":29,"ready":0,"readyWithWarnings":29,"insufficient":0,"rejected":0,"invalidValues":0,"warnings":["TIPS_UNVERIFIED"]},
    {"sportsDate":"2026-07-16","partition":"VALIDATION","rows":45,"ready":0,"readyWithWarnings":45,"insufficient":0,"rejected":0,"invalidValues":0,"warnings":["TIPS_UNVERIFIED"]},
    {"sportsDate":"2026-07-17","partition":"VALIDATION","rows":66,"ready":0,"readyWithWarnings":66,"insufficient":0,"rejected":0,"invalidValues":0,"warnings":["TIPS_UNVERIFIED"]},
    {"sportsDate":"2026-07-18","partition":"VALIDATION","rows":151,"ready":0,"readyWithWarnings":151,"insufficient":0,"rejected":0,"invalidValues":0,"warnings":["TIPS_UNVERIFIED"]},
    {"sportsDate":"2026-07-19","partition":"VALIDATION","rows":55,"ready":0,"readyWithWarnings":55,"insufficient":0,"rejected":0,"invalidValues":0,"warnings":["TIPS_UNVERIFIED"]},
    {"sportsDate":"2026-07-20","partition":"VALIDATION","rows":25,"ready":0,"readyWithWarnings":25,"insufficient":0,"rejected":0,"invalidValues":0,"warnings":["TIPS_UNVERIFIED"]},
    {"sportsDate":"2026-07-21","partition":"VALIDATION","rows":49,"ready":0,"readyWithWarnings":49,"insufficient":0,"rejected":0,"invalidValues":0,"warnings":["TIPS_UNVERIFIED"]}
  ],
  "matchedReadiness":{"total":98,"discovery":64,"validation":34,"ou25SemanticReady":98,"doubleChanceSemanticReady":98,"bothReady":98,"htSemanticReady":98,"handicap01SemanticReady":98,"withWarnings":98,"insufficient":0},
  "findings":[{"field":"statareaTip","findingType":"UNVERIFIED_FIELD","severity":"WARNING","count":1110,"expectedRule":"TIP remains separate and is not analyzed."}],
  "warnings":["Porcentajes fuente de Statarea; no son probabilidades reales ni calibradas."],
  "resultsUsed":0,
  "networkRequests":0,
  "assessmentHash":"7713be0f02cd30aee003686561e6e8015f031f48428d7046ef0bfa9508a2b77e"
}
